企業名,納品URL
独立行政法人国立高等専門学校機構	https://www.kosen-k.go.jp/,
日本港運株式会社	https://nipponkoun.co.jp/,
SECカーボン株式会社	https://sec-carbon.com/,
えひめ未来農業協同組合	https://ja-ehimemirai.or.jp/index.php,
株式会社エースシステムズ	https://www.acesystems.co.jp/,
株式会社エレコン	https://elecon-kk.co.jp/,
株式会社ききょう屋ソフト	https://kikyoya.co.jp/,
株式会社クア・アンド・ホテル	https://www.kur-hotel.co.jp/,
株式会社シエル石油大阪発売所	https://www.shellhatu.com/,
株式会社マツオカコーポレーション	https://www.matuoka.co.jp/about/company/,
株式会社関西東通	https://www.kansai-totsu.com/,
株式会社正英製作所	https://www.shoei-mfg.co.jp/,
株式会社北都鉄工	https://k-hokuto.co.jp/,
五洋商事株式会社	https://goyo.co.jp/,
三木楽器株式会社	https://www.miki.co.jp/,
社会福祉法人協同の苑	http://www.kyodo-no-sono.or.jp/,
社会福祉法人神戸福生会	https://www.kobe-fukuseikai.com/,
社会福祉法人千ヶ峰会	http://www.sengaminekai.or.jp/,
日本レヂボン株式会社	https://www.resibon.co.jp/,
兵庫南農業協同組合	https://www.ja-hyogominami.com/,
木下物産株式会社	https://www.kinoshita-bussan.com/,
有限会社河島農具製作所	https://kawashima-group.com/,
ササキセルム株式会社	https://www.sasakisellm.co.jp/,
サン・シールド株式会社	https://www.sunshield.co.jp/,
学校法人あさひ学園	https://www.asahi21.net/,
株式会社ABC	https://www.abc-p.jp/,
株式会社クレフォート	https://crefort.co.jp/company,
株式会社パッションギークス	https://mum-holdings.co.jp/passion-geeks/,
株式会社桶庄	https://okesho-group.jp/,
株式会社八幡ねじ	https://yht.co.jp/,
株式会社北日本テクノス	https://nj-technos.co.jp/,
九州伊藤精工株式会社	https://www.itohseiko.jp/group,
原田車両設計株式会社	https://www.hvd.co.jp/,
高雄工業株式会社	https://www.takao-net.co.jp/,
茶久染色株式会社	https://chakyu.co.jp/,
東海インプル建設株式会社	https://tokai-ic.com/,
未来工業株式会社	https://www.mirai.co.jp/,
Jotoホールディングス株式会社	https://www.jotohd.com/,
KTオフィス司法書士法人	https://kt-office.co.jp/about-us/,
NX・NPロジスティクス株式会社	https://www.nplc.co.jp/,
アオイ電子株式会社	https://www.aoi-electronics.co.jp/,
いすゞ自動車中国四国株式会社	https://isuzu-chushi.co.jp/,
ジャパンエステート株式会社	https://japanestate.page/,
ミカサ商事株式会社	https://www.mikasa.co.jp/,
株式会社アドバンスト・メディア	https://www.advanced-media.co.jp/,
株式会社ウインウイン	https://winwin-ad.com/company/overview/,
株式会社おもれい	https://www.omorey.com/,
株式会社カミタケモータース	https://www.kamitake.net/,
株式会社キリン堂	https://www.kirindo.co.jp/,
株式会社コーアツ	https://www.koatsu.co.jp/,
